timestamp,decision_id,decision_maker,decision_maker_role,scope,decision,rationale,evidence_or_request,status,subject_sha256,supersedes
2026-07-14T19:08:59+09:00,D-20260714190859-001,codex-screening,AI_ASSISTED_SCREENING,new-stage-examples,HOLD,본 스테이지 18개 후보 문장과 문항별 허용 답은 교사 확인 후 확정한다.,candidate-stage-plan.md,PROPOSED,,
2026-07-14T19:37:07+09:00,D-20260714193707-002,승인 사용자,TEACHER_RESEARCHER,new-stage-examples,MODIFY,후보안 전체를 승인하되 스테이지 2의 2번과 5번을 사용자가 지정한 문장으로 수정해 확정한다.,사용자 메시지(2026-07-14): 후보안 전체 승인; S2-2 공해가 매우 많아요.; S2-5 친구들이 하도 기다려서 택시를 탔어요.,CONFIRMED,,D-20260714190859-001
2026-07-14T19:37:08+09:00,D-20260714193708-003,승인 사용자,TEACHER_RESEARCHER,target-expressions,ACCEPT,"하도 A/V-아서/어서, -아서/어서, 그래서와 단독 정도 부사 아주·너무·진짜·매우·정말을 이 활동의 확정 목표 표현으로 사용한다.",사용자 메시지(2026-07-14)와 candidate-stage-plan.md 승인,CONFIRMED,8b6eafa1408fd39a161aa3973eade3a1bb5324551d21f528932cf79eb3e0e14d,
2026-07-14T19:37:08+09:00,D-20260714193708-004,승인 사용자,TEACHER_RESEARCHER,knowledge-basis,ACCEPT,기존 14과 자료의 구조 대비와 사용자가 승인한 18개 문장·범위 제한을 본 스테이지의 설계 근거로 확정한다.,candidate-stage-plan.md; c14/grammar1.html; c14/grammar1-block-studio.js; 사용자 승인 메시지(2026-07-14),CONFIRMED,,
2026-07-14T19:37:09+09:00,D-20260714193709-005,승인 사용자,TEACHER_RESEARCHER,learner-content-and-feedback,ACCEPT,"18개 완성 문장, 문항별 블록 답, 짧은 정오 피드백과 닫힌 도움말을 승인한다.",candidate-stage-plan.md; interaction-spec.yml; feedback-map.yml; 사용자 승인 메시지(2026-07-14),CONFIRMED,,
2026-07-14T19:37:09+09:00,D-20260714193709-006,승인 사용자,TEACHER_RESEARCHER,interaction-and-nonverbal,ACCEPT,"미완료 머리의 답 노출 방지, 정답 결합과 완성 문장 표시, 오답 튕김, 블록별 외곽선·부착 위치, 클릭·키보드 대체를 승인한다.",candidate-stage-plan.md 본 스테이지 카드 규칙과 보존 사항; interaction-spec.yml nonverbal_meaning_map,CONFIRMED,,
2026-07-14T20:10:39+09:00,D-20260714201039-007,승인 사용자,TEACHER_RESEARCHER,activity-name,MODIFY,"개선 활동이라는 구분을 없애고, 현재 개선본을 유일한 보조 활동으로 명확히 표시한다.",사용자 메시지(2026-07-14): 개선 활동(표현 블록 스튜디오) -> 보조 활동(표현 블록 맞추기)로 명칭 변경,CONFIRMED,,
